{
  "gating": {},
  "applied_rules": [
    {
      "rule_id": "anti_dilution.stale_ccp_detected",
      "applied_to": "series_seed",
      "result": "flagged"
    },
    {
      "rule_id": "cap_table.pricing_unknown_disclosure",
      "applied_to": "series_seed",
      "result": "flagged"
    },
    {
      "rule_id": "dual_class.founder_super_voting",
      "applied_to": "series_seed",
      "result": "flagged"
    },
    {
      "rule_id": "anti_dilution.solver_diverged",
      "applied_to": "series_seed",
      "result": "flagged"
    }
  ],
  "counsel_review_items": [
    {
      "rule_id": "anti_dilution.stale_ccp_detected",
      "domain": "anti_dilution",
      "title": "Stale current_conversion_price detected",
      "applies_when": "Use when the solver emits the stale-conversion-price warning warning.",
      "founder_question": "Cap-state inconsistency detected: current_conversion_price equals original_conversion_price on a preferred series, but cap_table_history shows a prior anti_dilution_applied event for that series. Indicates someone reset CCP after AD without persisting the change, or attached history without persisting CCP. Counsel reviews to verify which value is authoritative.",
      "counsel_question": "Cap-state inconsistency detected: current_conversion_price equals original_conversion_price on a preferred series, but cap_table_history shows a prior anti_dilution_applied event for that series. Indicates someone reset CCP after AD without persisting the change, or attached history without persisting CCP. Counsel reviews to verify which value is authoritative.",
      "documents_needed": [],
      "source_ids": [
        "NVCA-CERT-OF-INC"
      ]
    },
    {
      "rule_id": "cap_table.pricing_unknown_disclosure",
      "domain": "cap_table",
      "title": "Preferred pricing unknown — anti-dilution and 1:1 conversion assumption disclosed to counsel",
      "applies_when": "Use when any the cap-table state.preferred_series[*].the unknown-pricing flag is true. Does not fire when every preferred series has confirmed pricing.",
      "founder_question": "One or more preferred series is marked the unknown-pricing flag because the founder/mapper could not confirm the actual original_issue_price / original_conversion_price / current_conversion_price. The skill substitutes a numeric $1.00 sentinel for all three prices (so the schema's required-numeric and >0 gates pass without fabricating a real price) and forces anti_dilution_protection to 'none' for that series, since anti-dilution adjustment formulas are defined against the original issue/conversion price and cannot be run against a placeholder. This means anti-dilution and liquidation preference are NOT modeled for the series, and the conversion ratio is assumed 1:1 (original_conversion_price == current_conversion_price == 1.0) — i.e. no historical down-round adjustment is reflected even if one in fact occurred. Counsel/founder must confirm the actual issuance terms before relying on ownership, dilution, or preference figures involving this series.",
      "counsel_question": "One or more preferred series is marked the unknown-pricing flag because the founder/mapper could not confirm the actual original_issue_price / original_conversion_price / current_conversion_price. The skill substitutes a numeric $1.00 sentinel for all three prices (so the schema's required-numeric and >0 gates pass without fabricating a real price) and forces anti_dilution_protection to 'none' for that series, since anti-dilution adjustment formulas are defined against the original issue/conversion price and cannot be run against a placeholder. This means anti-dilution and liquidation preference are NOT modeled for the series, and the conversion ratio is assumed 1:1 (original_conversion_price == current_conversion_price == 1.0) — i.e. no historical down-round adjustment is reflected even if one in fact occurred. Counsel/founder must confirm the actual issuance terms before relying on ownership, dilution, or preference figures involving this series.",
      "documents_needed": [],
      "source_ids": [
        "NVCA-CERT-OF-INC"
      ]
    },
    {
      "rule_id": "dual_class.founder_super_voting",
      "domain": "dual_class",
      "title": "Dual-class voting structure detected — investor objections likely at later rounds",
      "applies_when": "Use when any the cap-table state.founders[*].voting_rights_multiple or the cap-table state.common_batches[*].voting_rights_multiple is not equal to 1.0.",
      "founder_question": "A founder or common-batch holder carries a voting_rights_multiple greater than 1.0 (super-voting common; typically class_b with 10x voting). Series A and later investors frequently push back on dual-class structures during diligence; NVCA model docs and Carta benchmarks both note that ratification of dual-class can require negotiation, and IPO underwriters may require sunset provisions. The cap-table report shows the resulting voting concentration in the dual-class summary table.",
      "counsel_question": "A founder or common-batch holder carries a voting_rights_multiple greater than 1.0 (super-voting common; typically class_b with 10x voting). Series A and later investors frequently push back on dual-class structures during diligence; NVCA model docs and Carta benchmarks both note that ratification of dual-class can require negotiation, and IPO underwriters may require sunset provisions. The cap-table report shows the resulting voting concentration in the dual-class summary table.",
      "documents_needed": [],
      "source_ids": [
        "NVCA-MODEL-COI-2019",
        "CARTA-FOUNDER-2026"
      ]
    },
    {
      "rule_id": "anti_dilution.solver_diverged",
      "domain": "anti_dilution",
      "title": "Coupled solver did not converge within max_iterations",
      "applies_when": "",
      "founder_question": "Runtime event emitted when priced_round.solve_priced_round hits its iteration cap without satisfying |Δp/p| < 1e-6 AND |Δp| < 1e-9. this is a math/convergence event that the script CAN conclude on (does not require counsel review). Investigation paths: check for pathological contraction (multi-series full-ratchet + heavy preferred stacking), coupled SAFE conversion at sub-CP1 cap, or post-money pool target.",
      "counsel_question": "Runtime event emitted when priced_round.solve_priced_round hits its iteration cap without satisfying |Δp/p| < 1e-6 AND |Δp| < 1e-9. this is a math/convergence event that the script CAN conclude on (does not require counsel review). Investigation paths: check for pathological contraction (multi-series full-ratchet + heavy preferred stacking), coupled SAFE conversion at sub-CP1 cap, or post-money pool target.",
      "documents_needed": [],
      "source_ids": [
        "NVCA-CERT-OF-INC"
      ]
    }
  ],
  "date_sensitive_watchlist": [
    {
      "rule_id": "delaware_cross_border.qsbs_date_sensitive",
      "title": "QSBS rules are date-sensitive",
      "scope": "legal_tax_applicability"
    }
  ],
  "metadata": {
    "run_id": "fixture-run"
  }
}
